[
  {
    "id": "motion.organic",
    "revision": 1,
    "term": "organic",
    "domain": "motion",
    "definition": "Natural-feeling motion without repetitive mechanical uniformity",
    "aliases": [
      "fluid",
      "natural"
    ],
    "interpretations": [
      {
        "id": "default",
        "context": [
          "motion"
        ],
        "meaning": "Natural-feeling motion without repetitive mechanical uniformity",
        "motionHints": [
          "gentle acceleration and coordinated secondary motion"
        ]
      }
    ],
    "provenance": {
      "source": "project",
      "reference": "MIP curated seed vocabulary; proposed project definitions, human review required"
    },
    "status": "proposed",
    "examples": [
      {
        "phrase": "Make the globe spin feel organic",
        "intent": "motion that feels natural, never mechanically uniform",
        "manifestation": "gentle acceleration with a small coordinated secondary motion"
      }
    ]
  },
  {
    "id": "motion.anticipation",
    "revision": 1,
    "term": "anticipation",
    "domain": "motion",
    "definition": "Preparatory action before the main movement",
    "aliases": [
      "wind-up",
      "preparation"
    ],
    "interpretations": [
      {
        "id": "default",
        "context": [
          "motion"
        ],
        "meaning": "Preparatory action before the main movement",
        "motionHints": [
          "small pre-action displacement"
        ]
      }
    ],
    "provenance": {
      "source": "project",
      "reference": "MIP curated seed vocabulary; proposed project definitions, human review required"
    },
    "status": "proposed",
    "examples": [
      {
        "phrase": "Add a wind-up before the globe turns",
        "intent": "a preparatory action that signals the main move",
        "manifestation": "a small pre-action displacement before the rotation starts"
      }
    ]
  },
  {
    "id": "cinematography.cinematic",
    "revision": 1,
    "term": "cinematic",
    "domain": "cinematography",
    "definition": "Film-like staging and pacing with clear narrative focus",
    "aliases": [
      "dramatic",
      "filmic"
    ],
    "interpretations": [
      {
        "id": "default",
        "context": [
          "cinematography"
        ],
        "meaning": "Film-like staging and pacing with clear narrative focus",
        "motionHints": [
          "coordinate framing lighting and rhythm"
        ]
      }
    ],
    "provenance": {
      "source": "project",
      "reference": "MIP curated seed vocabulary; proposed project definitions, human review required"
    },
    "status": "proposed",
    "examples": [
      {
        "phrase": "Give the reveal a cinematic feel",
        "intent": "film-like staging and pacing with a clear narrative focus",
        "manifestation": "framing, lighting and rhythm coordinated toward one focal subject"
      }
    ]
  },
  {
    "id": "timing.snappy",
    "revision": 1,
    "term": "snappy",
    "domain": "timing",
    "definition": "Quick deliberate motion with low perceived latency",
    "aliases": [
      "responsive",
      "quick"
    ],
    "interpretations": [
      {
        "id": "default",
        "context": [
          "timing"
        ],
        "meaning": "Quick deliberate motion with low perceived latency",
        "motionHints": [
          "short transition and crisp settle"
        ]
      }
    ],
    "provenance": {
      "source": "project",
      "reference": "MIP curated seed vocabulary; proposed project definitions, human review required"
    },
    "status": "proposed",
    "examples": [
      {
        "phrase": "Make the panel open snappy",
        "intent": "quick, deliberate motion with low perceived latency",
        "manifestation": "a short transition with a crisp settle"
      }
    ]
  },
  {
    "id": "motion.weighty",
    "revision": 1,
    "term": "weighty",
    "domain": "motion",
    "definition": "Motion conveying perceived mass and inertia",
    "aliases": [
      "heavy",
      "inertial"
    ],
    "interpretations": [
      {
        "id": "default",
        "context": [
          "motion"
        ],
        "meaning": "Motion conveying perceived mass and inertia",
        "motionHints": [
          "controlled acceleration and longer settle"
        ]
      }
    ],
    "provenance": {
      "source": "project",
      "reference": "MIP curated seed vocabulary; proposed project definitions, human review required"
    },
    "status": "proposed",
    "examples": [
      {
        "phrase": "Make the globe feel heavy",
        "intent": "motion that conveys mass and inertia",
        "manifestation": "controlled acceleration and a longer settle"
      }
    ]
  },
  {
    "id": "direction.magnetic",
    "revision": 1,
    "term": "magnetic",
    "domain": "direction",
    "definition": "Attraction of attention or subjects toward a focal point",
    "aliases": [
      "pulling",
      "attracting"
    ],
    "interpretations": [
      {
        "id": "default",
        "context": [
          "direction"
        ],
        "meaning": "Attraction of attention or subjects toward a focal point",
        "motionHints": [
          "focal pull or camera approach"
        ]
      }
    ],
    "provenance": {
      "source": "project",
      "reference": "MIP curated seed vocabulary; proposed project definitions, human review required"
    },
    "status": "proposed",
    "examples": [
      {
        "phrase": "Make the stars feel like they are pulling the eye",
        "intent": "attention drawn toward a focal point",
        "manifestation": "a focal pull or a camera approach toward the subject"
      }
    ]
  },
  {
    "id": "timing.ease-in",
    "revision": 1,
    "term": "ease-in",
    "domain": "timing",
    "definition": "Accelerating interpolation from rest",
    "aliases": [
      "accelerate"
    ],
    "interpretations": [
      {
        "id": "default",
        "context": [
          "timing"
        ],
        "meaning": "Accelerating interpolation from rest",
        "motionHints": [
          "ease-in curve"
        ]
      }
    ],
    "provenance": {
      "source": "project",
      "reference": "MIP curated seed vocabulary; proposed project definitions, human review required"
    },
    "status": "proposed",
    "examples": [
      {
        "phrase": "Use an ease-in for the start of the turn",
        "intent": "interpolation that accelerates away from rest",
        "manifestation": "an ease-in curve on the rotation track"
      }
    ]
  },
  {
    "id": "timing.ease-out",
    "revision": 1,
    "term": "ease-out",
    "domain": "timing",
    "definition": "Decelerating interpolation toward rest",
    "aliases": [
      "decelerate"
    ],
    "interpretations": [
      {
        "id": "default",
        "context": [
          "timing"
        ],
        "meaning": "Decelerating interpolation toward rest",
        "motionHints": [
          "ease-out curve"
        ]
      }
    ],
    "provenance": {
      "source": "project",
      "reference": "MIP curated seed vocabulary; proposed project definitions, human review required"
    },
    "status": "proposed",
    "examples": [
      {
        "phrase": "Use an ease-out so it can decelerate into place",
        "intent": "interpolation that slows toward rest",
        "manifestation": "an ease-out curve on the final approach"
      }
    ]
  },
  {
    "id": "timing.ease-in-out",
    "revision": 1,
    "term": "ease-in-out",
    "domain": "timing",
    "definition": "Smooth acceleration and deceleration",
    "aliases": [
      "smooth ease"
    ],
    "interpretations": [
      {
        "id": "default",
        "context": [
          "timing"
        ],
        "meaning": "Smooth acceleration and deceleration",
        "motionHints": [
          "s-curve"
        ]
      }
    ],
    "provenance": {
      "source": "project",
      "reference": "MIP curated seed vocabulary; proposed project definitions, human review required"
    },
    "status": "proposed",
    "examples": [
      {
        "phrase": "Use a smooth ease on the whole move",
        "intent": "smooth acceleration followed by smooth deceleration",
        "manifestation": "an s-curve across the keyframes"
      }
    ]
  },
  {
    "id": "motion.overshoot",
    "revision": 1,
    "term": "overshoot",
    "domain": "motion",
    "definition": "Movement beyond target followed by correction",
    "aliases": [
      "overtravel"
    ],
    "interpretations": [
      {
        "id": "default",
        "context": [
          "motion"
        ],
        "meaning": "Movement beyond target followed by correction",
        "motionHints": [
          "exceed then settle"
        ]
      }
    ],
    "provenance": {
      "source": "project",
      "reference": "MIP curated seed vocabulary; proposed project definitions, human review required"
    },
    "status": "proposed",
    "examples": [
      {
        "phrase": "Let the label overshoot its target",
        "intent": "movement that goes past the target and then corrects",
        "manifestation": "the track exceeds its end value, then settles back"
      }
    ]
  },
  {
    "id": "motion.follow-through",
    "revision": 1,
    "term": "follow-through",
    "domain": "motion",
    "definition": "Parts continue moving after primary body stops",
    "aliases": [
      "trailing"
    ],
    "interpretations": [
      {
        "id": "default",
        "context": [
          "motion"
        ],
        "meaning": "Parts continue moving after primary body stops",
        "motionHints": [
          "delayed secondary track"
        ]
      }
    ],
    "provenance": {
      "source": "project",
      "reference": "MIP curated seed vocabulary; proposed project definitions, human review required"
    },
    "status": "proposed",
    "examples": [
      {
        "phrase": "Add trailing follow-through on the ribbon",